{"artifact_status":"experimental","catalog_digest":"sha256:d4a951fe6ff8a7315c8d736d3810bb539c241935dec04f676b6109c891e6bd2f","operation_stage_digest":"sha256:e4af007a87443afb3a4a93cf477e3f968c151b66b7498e73e9b2c84b33593498","record_type":"pet-profile-executable-case-results","result_set_digest":"sha256:c169ad7f2121eb59b4d35fc6780f768df7eaa33498fd1436aa7a0d603289a8b8","results":[{"accepted_transition_ids":["TR-CREATE"],"case_id":"PET-VALID-SECRETFLOW-SELECTION","input_digest":"sha256:48a0c18ef341b7bd1e81555f5b18d994846bf8edab339b9c542f3d43d5c517b4","input_path":"generated/pet-integration/cases/pet-valid-secretflow-selection.v0.2.json","observer_digest":null,"operation_effect":"initialize_session","protocol_outcome":"accepted","query_budget_effect":"none","result_digest":"sha256:b241e51a1bbc7505ba323b0d211bbb3851eb40b479103f9af88db93182b862e1","result_visibility":"none","resulting_phase":"CREATED","runner_status":"pass","transcript_mutated":true},{"accepted_transition_ids":["TR-CREATE"],"case_id":"PET-VALID-NITRO-SELECTION","input_digest":"sha256:76f929202335e457193fbc2080341c6fdef626362602fb7f9f3db3343f43f6b6","input_path":"generated/pet-integration/cases/pet-valid-nitro-selection.v0.2.json","observer_digest":null,"operation_effect":"initialize_session","protocol_outcome":"accepted","query_budget_effect":"none","result_digest":"sha256:b241e51a1bbc7505ba323b0d211bbb3851eb40b479103f9af88db93182b862e1","result_visibility":"none","resulting_phase":"CREATED","runner_status":"pass","transcript_mutated":true},{"accepted_transition_ids":[],"case_id":"PET-VALID-VOPRF-REGISTRATION","input_digest":"sha256:26da07192b503fd40a54ba1e9c6d2b188222b4eb4fa96a5eef002d9e932ce6e6","input_path":"generated/pet-integration/cases/pet-valid-voprf-registration.v0.2.json","observer_digest":null,"operation_effect":"component-registration","protocol_outcome":"no-op","query_budget_effect":"none","result_digest":"sha256:c5624e6b00b1a46a926c351978db656405dd6f63f7ab2516b04ebbe2a4b17b37","result_visibility":"component-registration","resulting_phase":null,"runner_status":"pass","transcript_mutated":false},{"accepted_transition_ids":["TR-RESERVE-BUDGET"],"case_id":"PET-VALID-QUERY-BUDGET","input_digest":"sha256:48d3d560d82584a4c519bfd5853b043cece3df5ddcb3bed631a406b178102363","input_path":"generated/pet-integration/cases/pet-valid-query-budget.v0.2.json","observer_digest":null,"operation_effect":"reserve","protocol_outcome":"accepted","query_budget_effect":"reserve","result_digest":"sha256:5a5d7e9967fe6f270db257b7d9a01d4301fdd61e557f72650191fb63c00d8940","result_visibility":"none","resulting_phase":"COMMITMENTS_PENDING","runner_status":"pass","transcript_mutated":true},{"accepted_transition_ids":["TR-START-EVALUATION"],"case_id":"PET-VALID-EVALUATION-START","input_digest":"sha256:cd7b47773f41bd168b138a293a6f0aae749a0368fdce1e824e8793967e928c48","input_path":"generated/pet-integration/cases/pet-valid-evaluation-start.v0.2.json","observer_digest":null,"operation_effect":"consume_atomically","protocol_outcome":"accepted","query_budget_effect":"consume","result_digest":"sha256:7a49ca1559f2da2b10a1c9de109ec27c8e88ec681f5d501fb1c6aea83588436c","result_visibility":"none","resulting_phase":"EVALUATING","runner_status":"pass","transcript_mutated":true},{"accepted_transition_ids":["TR-SUBMIT-CONTRIBUTION-A"],"case_id":"PET-VALID-CONTRIBUTION-A","input_digest":"sha256:fa918f9246f95c46cc72cf550b2a62cf7ec7a232af805d38083f2b1f759570ce","input_path":"generated/pet-integration/cases/pet-valid-contribution-a.v0.2.json","observer_digest":null,"operation_effect":"bind_once","protocol_outcome":"accepted","query_budget_effect":"unchanged","result_digest":"sha256:824a4e3dd893474d3513146ab7bc8bff7b7431f3cde3e323cdd14dc5c468abd5","result_visibility":"none","resulting_phase":"EVALUATING","runner_status":"pass","transcript_mutated":true},{"accepted_transition_ids":["TR-SUBMIT-CONTRIBUTION-B"],"case_id":"PET-VALID-CONTRIBUTION-B","input_digest":"sha256:519e1b729da1535d877cfe13df385124b56dc8df30b2cdb48bfaa8eb99d979dd","input_path":"generated/pet-integration/cases/pet-valid-contribution-b.v0.2.json","observer_digest":null,"operation_effect":"bind_once","protocol_outcome":"accepted","query_budget_effect":"unchanged","result_digest":"sha256:1e4f8f81c8c46675be3600c9516433ea49b2169cb39d47bda6dfabbc0714be03","result_visibility":"none","resulting_phase":"EVALUATING","runner_status":"pass","transcript_mutated":true},{"accepted_transition_ids":["TR-ACK-RECEIPT-A"],"case_id":"PET-VALID-RECEIPT-A","input_digest":"sha256:60c3ac141fcfdb80d6fed4bf94eabbb4ecc9d8b4a5fd9ba7150581e60ea21ab6","input_path":"generated/pet-integration/cases/pet-valid-receipt-a.v0.2.json","observer_digest":null,"operation_effect":"set_if_unset_or_equal","protocol_outcome":"accepted","query_budget_effect":"unchanged","result_digest":"sha256:f3a77424026d7282376d8abb7be23f499a637d59989b971052e59233c2d0b2c7","result_visibility":"opaque-only","resulting_phase":"EVALUATING","runner_status":"pass","transcript_mutated":true},{"accepted_transition_ids":["TR-ACK-RECEIPT-B"],"case_id":"PET-VALID-RECEIPT-B","input_digest":"sha256:7a40b9942a7a97abd6e263b427b7b29679d68f882c424a1e686a9528062c1c30","input_path":"generated/pet-integration/cases/pet-valid-receipt-b.v0.2.json","observer_digest":null,"operation_effect":"set_if_unset_or_equal","protocol_outcome":"accepted","query_budget_effect":"unchanged","result_digest":"sha256:2898142f8c082d144622871dd388d432b97c1a344b50b7c9bf7e5d626ff9ea33","result_visibility":"opaque-only","resulting_phase":"EVALUATING","runner_status":"pass","transcript_mutated":true},{"accepted_transition_ids":["TR-ACCEPT-SYMMETRIC-RESULT"],"case_id":"PET-VALID-PROFILE-CALLBACK","input_digest":"sha256:d8ef2a5325ee509538128e61d40bc6ab1790716adf44188f9f8a017412bff967","input_path":"generated/pet-integration/cases/pet-valid-profile-callback.v0.2.json","observer_digest":"sha256:494db83db06ceb62db2b57b784e6f285e1c47c5c01126ba131099ef8bae1b26f","operation_effect":"set_and_increment","protocol_outcome":"accepted","query_budget_effect":"unchanged","result_digest":"sha256:2206c0ae8812472da17ac7293500a8465f6b3d1935bb642d264049bae84a6f6e","result_visibility":"party-local-observer-only","resulting_phase":"RESULT_ACCEPTED","runner_status":"pass","transcript_mutated":true},{"accepted_transition_ids":["TR-EVALUATION-TIMEOUT"],"case_id":"PET-VALID-EVALUATION-TIMEOUT","input_digest":"sha256:be75bb9280d19f10480a2d3cf0b65d0bcd14179a444f296f0128f8b3167f896b","input_path":"generated/pet-integration/cases/pet-valid-evaluation-timeout.v0.2.json","observer_digest":null,"operation_effect":"atomic_time_and_abort","protocol_outcome":"terminal","query_budget_effect":"preserve-consumed","result_digest":"sha256:f184b891f97d53ba6cb115537bf699930d21cd8248422a7c09571f50d6a78d1a","result_visibility":"none","resulting_phase":"ABORTED","runner_status":"pass","transcript_mutated":true},{"accepted_transition_ids":["TR-ABORT"],"case_id":"PET-VALID-CANCELLATION-CLEANUP","input_digest":"sha256:26dc20f1a070ac42c65a7d9eb359dd2b717bde3fa01c44faa19739ea97e7d7a8","input_path":"generated/pet-integration/cases/pet-valid-cancellation-cleanup.v0.2.json","observer_digest":null,"operation_effect":"atomic_generic_abort","protocol_outcome":"terminal","query_budget_effect":"preserve-consumed","result_digest":"sha256:577299c4825e78fec5a6ef2f777edec8aa6232d45a7be0d3d868271d4385443c","result_visibility":"none","resulting_phase":"ABORTED","runner_status":"pass","transcript_mutated":true},{"accepted_transition_ids":["TR-ABORT"],"case_id":"PET-VALID-ABORT-CREATED","input_digest":"sha256:e5155eb4152182058394a83f58a23bc2437e9c9685b07b7b673bea2309d90cf7","input_path":"generated/pet-integration/cases/pet-valid-abort-created.v0.2.json","observer_digest":null,"operation_effect":"atomic_generic_abort","protocol_outcome":"terminal","query_budget_effect":"release-if-not-started","result_digest":"sha256:c4be566fd5eebf23ec7d67794370daa1bba736d141bca8e1ac0d1d4f199d7147","result_visibility":"none","resulting_phase":"ABORTED","runner_status":"pass","transcript_mutated":true},{"accepted_transition_ids":["TR-ABORT"],"case_id":"PET-VALID-ABORT-PARTICIPANTS-BOUND","input_digest":"sha256:d42410e9f59be33ed83da5b54dd302b8e4806d02d1b01f4ec010b22de92f8814","input_path":"generated/pet-integration/cases/pet-valid-abort-participants-bound.v0.2.json","observer_digest":null,"operation_effect":"atomic_generic_abort","protocol_outcome":"terminal","query_budget_effect":"release-if-not-started","result_digest":"sha256:c4be566fd5eebf23ec7d67794370daa1bba736d141bca8e1ac0d1d4f199d7147","result_visibility":"none","resulting_phase":"ABORTED","runner_status":"pass","transcript_mutated":true},{"accepted_transition_ids":["TR-ABORT"],"case_id":"PET-VALID-ABORT-COMMITMENTS-PENDING","input_digest":"sha256:34fe5d28ee7f29e23ad24d9d8f4d6b840b3f3bb40565f8701b7f59448c330989","input_path":"generated/pet-integration/cases/pet-valid-abort-commitments-pending.v0.2.json","observer_digest":null,"operation_effect":"atomic_generic_abort","protocol_outcome":"terminal","query_budget_effect":"release-if-not-started","result_digest":"sha256:c4be566fd5eebf23ec7d67794370daa1bba736d141bca8e1ac0d1d4f199d7147","result_visibility":"none","resulting_phase":"ABORTED","runner_status":"pass","transcript_mutated":true},{"accepted_transition_ids":["TR-ABORT"],"case_id":"PET-VALID-ABORT-COMMITTED","input_digest":"sha256:847c779fe173e83493df57b4e4a32beca7811e0fd20297a092e24df588784b15","input_path":"generated/pet-integration/cases/pet-valid-abort-committed.v0.2.json","observer_digest":null,"operation_effect":"atomic_generic_abort","protocol_outcome":"terminal","query_budget_effect":"release-if-not-started","result_digest":"sha256:c4be566fd5eebf23ec7d67794370daa1bba736d141bca8e1ac0d1d4f199d7147","result_visibility":"none","resulting_phase":"ABORTED","runner_status":"pass","transcript_mutated":true},{"accepted_transition_ids":["TR-ABORT"],"case_id":"PET-VALID-ABORT-RESULT-ACCEPTED","input_digest":"sha256:a084b591de9d9b3ee53a028db0a29027558ef53f3